{
  "schema_version": 1,
  "run": {
    "id": "wt-synthetic-partial",
    "created_at": "2026-10-22T03:00:00Z",
    "finalized_at": "2026-10-22T03:30:00Z",
    "status": "partial",
    "generator": {
      "plugin": "session-walkthrough",
      "version": "0.1.0",
      "provider": "claude"
    },
    "host": {
      "platform": "darwin",
      "os_version": null
    }
  },
  "repository": {
    "project_id": "sample-project",
    "head_start": null,
    "head_end": "3f2a9c1e5b7d4a6f8e0c2b4d6f8a0c2e4a6c8e0b",
    "branch": "main",
    "dirty_at_end": true
  },
  "task": {
    "workflow_id": "wf-synthetic",
    "task_id": "task-1700000000-deadbeef",
    "executor": "sample-executor",
    "where": [
      "app/settings"
    ],
    "reported_paths": [
      "app/settings/Panel.tsx",
      "app/settings/theme.css",
      "lib/format.ts"
    ]
  },
  "scope": {
    "start": null,
    "start_unavailable_reason": "Walkthrough started after editing began",
    "end": {
      "captured_at": "2026-10-22T03:25:00Z",
      "head": "3f2a9c1e5b7d4a6f8e0c2b4d6f8a0c2e4a6c8e0b",
      "branch": "main",
      "entries": [
        {
          "path": "app/settings/Panel.tsx",
          "state": "modified",
          "sha256": "06f89015e1219702dd777daf044fb417ea6bc20d4bcb6d95513d3a1e69c26c72",
          "bytes": 1964
        },
        {
          "path": "app/settings/theme.css",
          "state": "modified",
          "sha256": "93f87988125cba1a8e4198dccbca8b7482535349fea17f4553bedfcaa57c09c8",
          "bytes": 702
        },
        {
          "path": "lib/format.ts",
          "state": "untracked",
          "sha256": "fb42bc0f6f0e63dada6567bdabc2b75533440ea43b76df3a5e62cc9aa9090418",
          "bytes": 410
        },
        {
          "path": "app/settings-other/legacy.css",
          "state": "untracked",
          "sha256": "6a8ec6764f4e29c2b37ddc07bce9a55f995cd08b9f45d85b6e52f9e0f0a4110a",
          "bytes": 88
        }
      ],
      "fingerprint": "83b0d8495f99b9635fa5895be9d7f36dc79bbab3217d5cc776db7f64ee4a674e",
      "max_bytes": 8388608
    },
    "committed_changes": [],
    "changed_paths": [
      {
        "path": "app/settings/Panel.tsx",
        "change": "unknown",
        "in_where": true,
        "reported": true,
        "attribution": "before unavailable"
      },
      {
        "path": "app/settings/theme.css",
        "change": "unknown",
        "in_where": true,
        "reported": true,
        "attribution": "before unavailable"
      },
      {
        "path": "lib/format.ts",
        "change": "unknown",
        "in_where": false,
        "reported": true,
        "attribution": "before unavailable"
      }
    ],
    "discrepancies": [
      {
        "kind": "before-unavailable",
        "path": null,
        "detail": "No start snapshot; changed paths are the executor's report"
      },
      {
        "kind": "outside-where",
        "path": "lib/format.ts",
        "detail": "Reported by the executor; outside the task WHERE prefix app/settings"
      },
      {
        "kind": "shared-tree: attribution uncertain",
        "path": null,
        "detail": "Two panes share this checkout; fingerprints do not prove authorship"
      }
    ],
    "shared_tree": true,
    "limitations": [
      "Fingerprints show that paths changed; they do not prove who changed them"
    ]
  },
  "target": {
    "platform": "web",
    "adapter": "web-chrome-devtools",
    "identity": {
      "origin": "http://127.0.0.1:4173"
    },
    "viewport": {
      "width": 1280,
      "height": 800,
      "scale": 1
    },
    "tool_versions": {
      "chrome-devtools-mcp": "0.0.0-synthetic"
    },
    "capabilities": {
      "observe": true,
      "record": false,
      "drive": "none"
    }
  },
  "build": {
    "freshness": "unverified",
    "receipt": null,
    "unbound_paths": [],
    "reason": "No build-info endpoint declared for this origin"
  },
  "chapters": [
    {
      "id": "settings-theme",
      "title": "Settings panel dark theme",
      "scenario": "Open Settings and toggle the dark theme.",
      "source_paths": [
        "app/settings/Panel.tsx"
      ],
      "actions": [
        "Open Settings",
        "Toggle Dark theme"
      ],
      "checkpoints": [
        "Panel uses the dark palette"
      ],
      "before": {
        "asset": null,
        "unavailable_reason": "Baseline not captured; walkthrough started after editing"
      },
      "after": {
        "asset": "after-settings"
      },
      "observation": "The panel shows the dark palette; no baseline exists for comparison.",
      "assertions": [],
      "status": "demonstrated",
      "reason": null,
      "captured_at": "2026-10-22T03:25:00Z"
    },
    {
      "id": "theme-tokens",
      "title": "Theme token sheet",
      "scenario": "Open the token sheet that renders theme.css values.",
      "source_paths": [
        "app/settings/theme.css"
      ],
      "actions": [
        "Open the token sheet"
      ],
      "checkpoints": [],
      "before": {
        "asset": null,
        "unavailable_reason": "Baseline not captured"
      },
      "after": {
        "asset": null
      },
      "observation": null,
      "assertions": [],
      "status": "failed",
      "reason": "Screenshot tool returned an empty image; Screen Recording permission missing",
      "captured_at": null
    }
  ],
  "assets": [
    {
      "id": "after-settings",
      "path": "assets/after.png",
      "media_type": "image/png",
      "sha256": "82ce16daa2ae5c36cdaf7bdb65c50228cc586966b140e25756dec652a8783692",
      "bytes": 73,
      "recording_kind": "stills",
      "duration_seconds": null,
      "codec": null,
      "frame_interval_seconds": null,
      "captions": [],
      "captured_at": "2026-10-22T03:25:00Z",
      "tool": {
        "adapter": "web-chrome-devtools",
        "command": null,
        "version": "0.0.0-synthetic"
      },
      "normalized_from": null,
      "privacy_review": "synthetic-data"
    }
  ],
  "coverage": {
    "paths": [
      {
        "path": "app/settings/Panel.tsx",
        "status": "demonstrated",
        "chapters": [
          "settings-theme"
        ],
        "reason": null
      },
      {
        "path": "app/settings/theme.css",
        "status": "failed",
        "chapters": [
          "theme-tokens"
        ],
        "reason": "Capture failed; see chapter theme-tokens"
      },
      {
        "path": "lib/format.ts",
        "status": "omitted: non-visual",
        "chapters": [],
        "reason": "Formatting helper with no rendered surface"
      }
    ],
    "limitations": [
      "No baseline; build freshness unverified"
    ]
  },
  "privacy": {
    "demo_data": "synthetic",
    "capture_scope": "origin",
    "egress": "opt-out-configured",
    "notes": [
      "Synthetic fixture; no real application was captured"
    ]
  }
}
